{"artifact":"LOCUS-performance-processed-v1","enrollment_latency_ms":{"series":[230.87544699956197,290.48981799860485,286.8441540013009,233.52097300085006,237.3998209986894,244.2072369995003,284.3166390011902,284.93683299893746,252.2425499992096,302.78863700004877,186.6192650013545,253.62817899804213,181.26774899792508,236.0016659986286,299.0578800017829,208.54346499982057,240.03967300086515,292.78307799904724,244.29907300145715,250.69402799999807,302.6318230004108,248.79307499941206,185.86192399743595,243.3957190005458,254.82723100139992,306.1237420006364,210.0125979995937,290.19498900015606,220.1188689978153,265.95619399813586],"summary":{"count":30,"max":306.1237420006364,"mean":252.2824109664119,"median":249.74355149970506,"median_ci95":{"lower":238.71974699977727,"upper":275.136416499663},"min":181.26774899792508,"p05":186.2027274491993,"p25":234.1411462502947,"p75":286.36732375071006,"p95":302.7180707002117}},"processing":{"blocks":10,"bootstrap":{"algorithm":"sha256-counter-index-v1","confidence":0.95,"resamples":10000,"seed":20260723},"quantile_method":"linear-type-7","samples_per_scenario":30,"scenarios":["enroll-recover-success-v1","recover-one-party-unavailable-v1","recover-wrong-input-v1"]},"scenarios":{"enroll-recover-success-v1":{"application_bytes":{"authorization":{"received":{"series":[9540,9540,9540,9540,9540,9540,9540,9540,9540,9540,9540,9540,9540,9540,9540,9540,9540,9540,9540,9540,9540,9540,9540,9540,9540,9540,9540,9540,9540,9540],"summary":{"count":30,"distinct":[9540],"max":9540,"min":9540}},"sent":{"series":[33790,33790,33790,33790,33790,33790,33790,33790,33790,33790,33790,33790,33790,33790,33790,33790,33790,33790,33790,33790,33790,33790,33790,33790,33790,33790,33790,33790,33790,33790],"summary":{"count":30,"distinct":[33790],"max":33790,"min":33790}}},"cloud":{"received":{"series":[1013,1013,1013,1013,1013,1013,1013,1013,1013,1013,1013,1013,1013,1013,1013,1013,1013,1013,1013,1013,1013,1013,1013,1013,1013,1013,1013,1013,1013,1013],"summary":{"count":30,"distinct":[1013],"max":1013,"min":1013}},"sent":{"series":[0,0,0,0,0,0,0,0,0,0,0,0,0,0,0,0,0,0,0,0,0,0,0,0,0,0,0,0,0,0],"summary":{"count":30,"distinct":[0],"max":0,"min":0}}},"resolver":{"received":{"series":[387,387,387,387,387,387,387,387,387,387,387,387,387,387,387,387,387,387,387,387,387,387,387,387,387,387,387,387,387,387],"summary":{"count":30,"distinct":[387],"max":387,"min":387}},"sent":{"series":[0,0,0,0,0,0,0,0,0,0,0,0,0,0,0,0,0,0,0,0,0,0,0,0,0,0,0,0,0,0],"summary":{"count":30,"distinct":[0],"max":0,"min":0}}},"tpass":{"received":{"series":[1226,1226,1226,1226,1226,1226,1226,1226,1226,1226,1226,1226,1226,1226,1226,1226,1226,1226,1226,1226,1226,1226,1226,1226,1226,1226,1226,1226,1226,1226],"summary":{"count":30,"distinct":[1226],"max":1226,"min":1226}},"sent":{"series":[8766,8766,8766,8766,8766,8766,8766,8766,8766,8766,8766,8766,8766,8766,8766,8766,8766,8766,8766,8766,8766,8766,8766,8766,8766,8766,8766,8766,8766,8766],"summary":{"count":30,"distinct":[8766],"max":8766,"min":8766}}}},"latency_ms":{"authorization":{"series":[250.6899660002091,179.44539399832138,240.520233001007,191.90667700240738,207.10547500129906,185.80679799924837,196.58545699712704,171.41064099996584,208.8373539991153,193.76265599930775,230.92923700096435,196.21049000124913,192.7578379982151,197.45174499985296,207.09568399979617,179.82426600065082,217.86653299932368,176.68955599947367,189.1333309977199,173.67870700036292,226.02562400061288,185.19247099902714,173.43490100029157,246.86160599958384,178.72919699948397,226.96325600190903,207.60934700228972,246.71827099882648,174.53765000027488,205.93337999889627],"summary":{"count":30,"max":250.6899660002091,"mean":201.9904580332271,"median":196.39797349918808,"median_ci95":{"lower":187.47006449848413,"upper":207.3574110017944},"min":171.41064099996584,"p05":173.54461370032368,"p25":181.1663172502449,"p75":215.60923824927158,"p95":246.79710524924303}},"client_setup":{"series":[6.193281999003375,6.850147998193279,6.4023669983725995,8.288274002552498,7.140305999200791,14.342227001179708,6.314805999863893,6.8459879985312,9.758201998920413,7.267175999004394,9.240415998647222,7.3709759999474045,6.848917000752408,7.121500999346608,6.824207997851772,6.1712589995295275,8.220081999752438,7.070605002809316,7.44112599932123,6.858176999230636,7.036200000584358,6.759697000234155,7.074863999150693,12.256676000106381,6.512987001769943,6.607516999793006,6.742492998455418,5.754671001341194,6.623959998250939,7.1649970013822895],"summary":{"count":30,"max":14.342227001179708,"mean":7.50347016643597,"median":6.947188499907497,"median_ci95":{"lower":6.791952499042964,"upper":7.152960137818805},"min":5.754671001341194,"p05":6.181169349292759,"p25":6.653593248302059,"p75":7.345025999711652,"p95":11.132362699572688}},"cloud":{"series":[228.33111900035874,8.7699989999237,9.326174000307219,271.8058770005882,9.247971000149846,12.164864001533715,235.70009600007324,7.996898002602393,18.74768400011817,267.86549399912474,16.03809399966849,9.413840001798235,258.9509089993953,8.050907999859191,9.728300999995554,223.0538859985245,9.348403997137211,10.66077199720894,226.0748370026704,8.1591540001682,9.37930299915024,254.84482999672764,7.9826130022411235,13.986245001433417,220.17394300200976,7.914882000477519,7.612890000018524,211.98117699896102,8.14694899963797,8.381833999010269],"summary":{"count":30,"max":271.8058770005882,"mean":86.66133156669578,"median":10.194536498602247,"median_ci95":{"lower":9.287072500228533,"upper":115.3644304995396},"min":7.612890000018524,"p05":7.945360951271141,"p25":8.478875249238627,"p75":222.3339002493958,"p95":263.8539307492465}},"commitment":{"series":[110.71061300026486,106.27291000128025,126.54417799785733,108.96563900314504,163.92205100055435,114.55680899962317,102.62675099875196,118.1658259993128,114.84765299974242,161.6874020000978,111.32648499915376,112.71288100033416,99.49600400068448,111.9614269991871,111.28112600272289,97.28121100124554,161.15254699980142,106.54868499841541,101.21281799729331,132.14063299892587,151.35866800119402,108.95391899975948,159.1175329995167,158.07147200030158,107.79989200091222,182.9208480012312,114.43235799742979,116.42350400143187,105.33662200032268,121.37878000066848],"summary":{"count":30,"max":182.9208480012312,"mean":123.3069081667054,"median":113.57261949888198,"median_ci95":{"lower":109.83812600170495,"upper":119.77230299999064},"min":97.28121100124554,"p05":100.26857029915845,"p25":108.08839875062404,"p75":130.74151924865873,"p95":162.9164589503489}},"finalization":{"series":[1.0209949978161603,0.7630319996678736,0.6529099991894327,0.9842149993346538,1.3787130010314286,0.7052809996821452,1.1392979977244977,1.8934069994429592,0.6487960017693695,3.8486939993163105,0.8647670001664665,0.8036270010052249,0.9598300021025352,0.8287419987027533,0.6417730000976007,1.7390760003763717,1.3016240009164903,1.5912150010990445,1.1278159981884528,1.7195110012835357,0.7701100003032479,1.00327000109246,2.023120003286749,0.7237749996420462,1.0450430017954204,0.6757390001439489,1.4004839977133088,0.9566720000293572,0.7247809990076348,1.876408998214174],"summary":{"count":30,"max":3.8486939993163105,"mean":1.1937575000047218,"median":0.9937425002135569,"median_ci95":{"lower":0.8161844998539891,"upper":1.220460999320494},"min":0.6417730000976007,"p05":0.6506473006083979,"p25":0.7648014998267172,"p75":1.3950412485428387,"p95":1.9647491515570432}},"resolver":{"series":[19.07418799964944,1.5270399999280926,1.5404659970954526,21.606670001347084,1.5343650011345744,1.5481539994652849,18.29676299894345,1.33427400214714,3.1168640016403515,22.055888999602757,1.9224819989176467,2.1768520018667914,21.099567002238473,1.8387899981462397,1.6381519999413285,19.160982003086247,1.476422003179323,1.7024689987010788,19.809609002550133,1.3741719994868618,2.079039997624932,19.036903999221977,1.589473002240993,2.8941150012542494,20.38832700054627,1.4641950001532678,1.4124910012469627,18.339379003009526,1.3735669999732636,1.4535180016537197],"summary":{"count":30,"max":22.055888999602757,"mean":7.795505967199763,"median":1.8806359985319432,"median_ci95":{"lower":1.5443099982803687,"upper":10.7068135002919},"min":1.33427400214714,"p05":1.3738392497543828,"p25":1.528871250229713,"p75":18.862522750168864,"p95":21.37847365174821}},"response":{"series":[30.601202000980265,29.887625998526346,25.00462299940409,33.021450999513036,46.96078200140619,34.393714002362685,27.292943999782437,50.342637001449475,19.525310999597423,54.94218300009379,29.66499999820371,34.32465600053547,20.848834999924293,32.981616001052316,30.95957100231317,28.48312200148939,22.792227999161696,36.213949002558365,31.813472000067122,52.42409199854592,30.335858999023912,19.224588002543896,54.906032000872074,44.462167999881785,31.143759002588922,23.336312999163056,37.048391001007985,20.050938001077157,20.252895999874454,27.44665300269844],"summary":{"count":30,"max":54.94218300009379,"mean":32.6895537005233,"median":30.780386501646717,"median_ci95":{"lower":27.964887502093916,"upper":33.67305350002425},"min":19.224588002543896,"p05":19.761843150263303,"p25":25.576703249498678,"p75":35.758890252509445,"p95":53.7891589998253}},"status_check":{"series":[7.414359002723359,14.069322001887485,6.699191999359755,8.860317000653595,19.536268002411816,8.742919002543204,6.878552998387022,25.217025002348237,9.02669000060996,23.353302000032272,7.993917999556288,9.661908999987645,7.521529001678573,8.360324001841946,8.438114000455244,14.634068000304978,18.039047998172464,9.375691999593982,7.570110999949975,11.010267000528984,9.795804999157554,7.881658002588665,18.629542999406112,11.960823998379055,6.551352998940274,6.541215003380785,9.423736002645455,8.320595999975922,8.705244999873685,24.837046999891754],"summary":{"count":30,"max":25.217025002348237,"mean":11.5016649672422,"median":8.943503500631778,"median_ci95":{"lower":8.340460000908934,"upper":10.81304019917295},"min":6.541215003380785,"p05":6.6178805491290404,"p25":7.909723001830571,"p75":13.542197501010378,"p95":